{
  "id": "quarry",
  "name": "Mining Quarry",
  "source": "scan",
  "size_m": [
    725.0,
    725.0
  ],
  "origin": [
    -362.5,
    -362.5
  ],
  "bounds": [
    -362.5,
    -362.5,
    362.5,
    362.5
  ],
  "assets": {
    "visual": "visual.glb",
    "collider": "collider.glb",
    "terrain_mesh": "terrain.glb",
    "splat": null,
    "pano": "sky_pano.jpg",
    "concept": null,
    "heightmap_raw": "heightmap.raw",
    "heightmap_meta": "heightmap_meta.json",
    "preview": "preview.png",
    "pano_source": "World Labs Marble world marble_surround (sky/horizon backdrop)",
    "surround": "surround.glb"
  },
  "scan_transform": {
    "scale": 44.046406,
    "rotation_euler_deg": [
      0,
      0,
      0
    ],
    "rotation_matrix": [
      [
        1.0,
        0.0,
        0.0
      ],
      [
        0.0,
        1.0,
        0.0
      ],
      [
        0.0,
        0.0,
        1.0
      ]
    ],
    "translation": [
      -106.0677,
      9.0321,
      -158.7101
    ],
    "up_axis": "+y",
    "frame": "gltf",
    "matrix": [
      [
        44.046406,
        0.0,
        0.0,
        -106.06767
      ],
      [
        0.0,
        44.046406,
        0.0,
        9.032103
      ],
      [
        0.0,
        0.0,
        44.046406,
        -158.710103
      ],
      [
        0.0,
        0.0,
        0.0,
        1.0
      ]
    ],
    "order": "p_world = scale * (R @ p_gltf) + translation; p_gltf = visual.glb vertex in glTF scene space (node transforms applied, Y up). matrix = same, 4x4 row-major, column vectors.",
    "native_extent_xz": [
      16.4599,
      10.6774
    ],
    "metric": false,
    "ref_percentile": 90.0,
    "source_file": "mining_quarry.glb"
  },
  "sites": [
    {
      "id": "ore_1",
      "type": "ore",
      "name": "Lower Face",
      "pos": [
        -21.25,
        -66.25
      ],
      "tonnes": 8000,
      "pos3": [
        -21.25,
        -112.06,
        -66.25
      ],
      "load_point": {
        "pos3": [
          -21.25,
          -112.06,
          -66.25
        ],
        "heading_deg": 90.0
      }
    },
    {
      "id": "ore_2",
      "type": "ore",
      "name": "Middle Face",
      "pos": [
        48.75,
        18.75
      ],
      "tonnes": 6000,
      "pos3": [
        48.75,
        -102.29,
        18.75
      ],
      "load_point": {
        "pos3": [
          48.75,
          -102.29,
          18.75
        ],
        "heading_deg": 70.1
      }
    },
    {
      "id": "ore_3",
      "type": "ore",
      "name": "Upper Face",
      "pos": [
        156.25,
        51.25
      ],
      "tonnes": 4500,
      "pos3": [
        156.25,
        -47.52,
        51.25
      ],
      "load_point": {
        "pos3": [
          156.25,
          -47.52,
          51.25
        ],
        "heading_deg": 165.9
      }
    },
    {
      "id": "crusher",
      "type": "crusher",
      "name": "Primary Crusher",
      "pos": [
        -263.75,
        -23.75
      ],
      "pos3": [
        -263.75,
        -128.72,
        -23.75
      ],
      "dump_point": {
        "pos3": [
          -263.75,
          -128.72,
          -23.75
        ],
        "heading_deg": 277.0
      }
    },
    {
      "id": "dump",
      "type": "dump",
      "name": "Waste Dump",
      "pos": [
        3.75,
        -28.75
      ],
      "pos3": [
        3.75,
        -108.6,
        -28.75
      ],
      "dump_point": {
        "pos3": [
          3.75,
          -108.6,
          -28.75
        ],
        "heading_deg": 315.0
      }
    },
    {
      "id": "parking",
      "type": "parking",
      "name": "Ready Line",
      "pos": [
        -256.25,
        43.75
      ],
      "pos3": [
        -256.25,
        -110.5,
        43.75
      ],
      "slots": [
        {
          "pos3": [
            -258.83,
            -110.29,
            47.91
          ],
          "heading_deg": 58.2
        },
        {
          "pos3": [
            -256.25,
            -110.5,
            43.75
          ],
          "heading_deg": 58.2
        },
        {
          "pos3": [
            -253.67,
            -110.52,
            39.59
          ],
          "heading_deg": 58.2
        }
      ]
    },
    {
      "id": "fuel",
      "type": "fuel",
      "name": "Fuel Bay",
      "pos": [
        -271.25,
        31.25
      ],
      "pos3": [
        -271.25,
        -111.92,
        31.25
      ]
    }
  ],
  "junctions": [
    {
      "id": "j_1",
      "name": "Junction 1",
      "pos": [
        8.75,
        -108.51,
        -33.75
      ]
    },
    {
      "id": "j_2",
      "name": "Junction 2",
      "pos": [
        -158.75,
        -103.0,
        36.25
      ]
    }
  ],
  "roads": [
    {
      "id": "ramp_1",
      "name": "Lower Face - Primary Crusher",
      "type": "ramp",
      "from": "ore_1",
      "to": "crusher",
      "width_m": 16.5,
      "grade_pct": 7.2,
      "one_way": false,
      "points": [
        [
          -21.25,
          -112.06,
          -66.25
        ],
        [
          -23.91,
          -112.35,
          -66.25
        ],
        [
          -28.75,
          -112.85,
          -66.25
        ],
        [
          -33.75,
          -113.11,
          -66.25
        ],
        [
          -38.75,
          -113.55,
          -66.25
        ],
        [
          -41.25,
          -113.77,
          -66.25
        ],
        [
          -46.25,
          -114.19,
          -66.25
        ],
        [
          -51.25,
          -114.56,
          -66.25
        ],
        [
          -56.25,
          -114.96,
          -66.25
        ],
        [
          -61.25,
          -115.29,
          -66.25
        ],
        [
          -66.25,
          -115.59,
          -66.25
        ],
        [
          -71.25,
          -115.94,
          -66.25
        ],
        [
          -76.25,
          -116.33,
          -66.25
        ],
        [
          -78.75,
          -116.47,
          -66.25
        ],
        [
          -81.25,
          -116.65,
          -66.24
        ],
        [
          -83.75,
          -116.79,
          -66.1
        ],
        [
          -86.25,
          -116.92,
          -65.5
        ],
        [
          -88.75,
          -116.86,
          -64.5
        ],
        [
          -91.25,
          -116.98,
          -63.9
        ],
        [
          -93.75,
          -117.13,
          -63.76
        ],
        [
          -96.25,
          -117.3,
          -63.75
        ],
        [
          -98.75,
          -117.45,
          -63.74
        ],
        [
          -101.25,
          -117.61,
          -63.6
        ],
        [
          -103.75,
          -117.73,
          -63.0
        ],
        [
          -106.25,
          -117.84,
          -61.99
        ],
        [
          -108.75,
          -117.87,
          -61.25
        ],
        [
          -111.25,
          -117.82,
          -60.51
        ],
        [
          -113.75,
          -117.77,
          -59.49
        ],
        [
          -116.25,
          -117.7,
          -58.75
        ],
        [
          -118.75,
          -117.61,
          -58.0
        ],
        [
          -121.25,
          -117.39,
          -56.86
        ],
        [
          -123.75,
          -117.26,
          -55.65
        ],
        [
          -126.25,
          -117.18,
          -54.51
        ],
        [
          -128.75,
          -117.08,
          -53.9
        ],
        [
          -131.25,
          -117.05,
          -53.76
        ],
        [
          -133.75,
          -116.98,
          -53.75
        ],
        [
          -136.25,
          -116.84,
          -53.75
        ],
        [
          -141.25,
          -116.64,
          -53.75
        ],
        [
          -143.75,
          -116.63,
          -53.75
        ],
        [
          -146.25,
          -116.59,
          -53.76
        ],
        [
          -148.75,
          -116.57,
          -53.9
        ],
        [
          -151.25,
          -116.57,
          -54.5
        ],
        [
          -153.74,
          -116.74,
          -55.51
        ],
        [
          -158.0,
          -117.26,
          -56.99
        ],
        [
          -161.4,
          -117.82,
          -58.46
        ],
        [
          -163.76,
          -117.99,
          -57.99
        ],
        [
          -166.25,
          -118.18,
          -56.99
        ],
        [
          -168.75,
          -118.42,
          -56.25
        ],
        [
          -171.25,
          -118.59,
          -55.51
        ],
        [
          -173.75,
          -118.75,
          -54.49
        ],
        [
          -176.25,
          -118.91,
          -53.74
        ],
        [
          -178.75,
          -119.25,
          -52.86
        ],
        [
          -181.25,
          -119.48,
          -51.24
        ],
        [
          -183.75,
          -119.74,
          -49.49
        ],
        [
          -186.25,
          -119.93,
          -48.0
        ],
        [
          -188.75,
          -120.21,
          -46.1
        ],
        [
          -191.25,
          -120.24,
          -43.75
        ],
        [
          -193.75,
          -120.38,
          -41.4
        ],
        [
          -196.25,
          -120.78,
          -39.5
        ],
        [
          -198.74,
          -121.08,
          -38.02
        ],
        [
          -201.1,
          -121.25,
          -36.41
        ],
        [
          -204.5,
          -121.73,
          -35.51
        ],
        [
          -208.76,
          -122.2,
          -34.33
        ],
        [
          -211.24,
          -122.53,
          -33.01
        ],
        [
          -215.5,
          -122.94,
          -30.4
        ],
        [
          -218.88,
          -123.41,
          -31.1
        ],
        [
          -222.99,
          -123.79,
          -30.36